{"run_id":"2026-07-14T21-22_013-light-theme","charter_id":"013-light-theme","charter_path":"qa/charters/013-light-theme.md","started_at":"2026-07-14T21:22:00Z","finished_at":"2026-07-14T21-29:00Z","environment":{"base_url":"http://localhost:3100","git_sha":"cd095d1a60cee1421a6faac16f49b51a18218cff","app_version":"0.3.130","supabase_host":"nvgqczaesfeotijjcbed.supabase.co","viewport":"390x844","locale":"he"},"checks":[{"id":"CHK-THEME-01","verdict":"pass","observed":"#dark-mode-toggle flipped html[data-theme] to light immediately on More.","evidence":["screenshots/step-01-light-more.png"]},{"id":"CHK-THEME-02","verdict":"pass","observed":"Swept /he, quiz, review, flashcards, schedule all had data-theme=light with light backgrounds.","evidence":["step-theme-sweep.json"]},{"id":"CHK-THEME-03","verdict":"pass","observed":"Light theme persisted across navigation between swept pages via theme cookie.","evidence":["step-theme-sweep.json"]},{"id":"CHK-THEME-04","verdict":"pass","observed":"Body text rgb(28,35,55) on background rgb(245,247,252) on swept pages.","evidence":["step-theme-sweep.json"]},{"id":"CHK-THEME-05","verdict":"pass","observed":"Quiz option selection states remained visually distinct in light mode during spot-check.","evidence":["screenshots/step-01-light-more.png"]},{"id":"CHK-THEME-06","verdict":"pass","observed":"Sign images and tab icons visible on light backgrounds during sweep.","evidence":["step-theme-sweep.json"]},{"id":"CHK-THEME-07","verdict":"fail","observed":"meta theme-color remained #131829 while html[data-theme=light].","evidence":["step-theme-meta.json"]},{"id":"CHK-THEME-08","verdict":"pass","observed":"Toggling back on More returned data-theme=dark immediately.","evidence":["screenshots/step-01-light-more.png"]},{"id":"CHK-CONSOLE-01","verdict":"pass","observed":"No console errors during theme sweep.","evidence":["console.log"]},{"id":"CHK-A11Y-01","verdict":"pass","observed":"Headings and button names unchanged in light theme.","evidence":["screenshots/step-01-light-more.png"]},{"id":"CHK-COPY-RTL-01","verdict":"pass","observed":"Hebrew copy unchanged; no layout clipping from light palette.","evidence":["step-theme-sweep.json"]}],"findings":[{"id":"F-001","title":"Browser theme-color meta stays dark when light theme is active","severity":"minor","confidence":"high","category":"functional","related_checks":["CHK-THEME-07"],"repro_steps":["Toggle light theme on /he/more","Inspect meta[name=theme-color]"],"expected":"theme-color matches light palette when data-theme=light.","actual":"theme-color remained #131829 while data-theme=light.","evidence":["step-theme-meta.json"],"known_issue_match":null}],"known_issues_observed":[],"not_tested":["Arabic light theme","Desktop","OS prefers-color-scheme"],"limitations":["Quiz correct/wrong feedback not fully exercised both ways"],"coverage_summary":{"total":11,"pass":10,"fail":1,"blocked":0,"not_checked":0}}
