{"run_id":"2026-07-15T17-48_008-auth-and-login-edges","charter_id":"008-auth-and-login-edges","charter_path":"qa/charters/008-auth-and-login-edges.md","started_at":"2026-07-15T15:05:00Z","finished_at":"2026-07-15T15:12:00Z","environment":{"base_url":"http://localhost:3100","git_sha":"172d979df3635ffe402dc96c524ee32122e05c2f","app_version":"0.3.141","supabase_host":"nvgqczaesfeotijjcbed.supabase.co","viewport":"390x844","locale":"he"},"checks":[{"id":"CHK-LOGIN-01","verdict":"blocked","observed":"MCP browser shares cookies across pages; could not observe cookie-less deep-link redirect to login.","evidence":[],"reason":"automation cannot isolate cookie-less browser context"},{"id":"CHK-LOGIN-02","verdict":"pass","observed":"Login form with email input and send button; Hebrew RTL hero copy rendered.","evidence":["screenshots/step-01-login.png"]},{"id":"CHK-LOGIN-03","verdict":"pass","observed":"Invalid email not-an-email rejected client-side without send-otp.","evidence":["screenshots/step-01-login.png"]},{"id":"CHK-LOGIN-04","verdict":"pass","observed":"Valid plus-tag email POSTed send-otp; sent banner הקישור נשלח appeared.","evidence":["screenshots/step-01-login.png"]},{"id":"CHK-LOGIN-05","verdict":"not-checked","observed":"","evidence":[],"reason":"timebox — resend throttle window not waited out"},{"id":"CHK-LOGIN-06","verdict":"pass","observed":"/he/auth/login?error=1 shows expired link error state with usable form.","evidence":["screenshots/step-02-login-error.png"]},{"id":"CHK-LOGIN-07","verdict":"pass","observed":"Garbage callback token_hash=garbage redirected to /he/auth/login?error=1.","evidence":["screenshots/step-03-garbage-callback.png"]},{"id":"CHK-LOGIN-08","verdict":"not-checked","observed":"","evidence":[],"reason":"timebox — rate limit exhaustion not attempted to avoid burning qa-user limit"},{"id":"CHK-CONSOLE-01","verdict":"pass","observed":"No error-level console entries on login flow.","evidence":["console.log"]},{"id":"CHK-A11Y-01","verdict":"pass","observed":"Email input labeled; headings present; lang=he dir=rtl.","evidence":["screenshots/step-01-login.png"]},{"id":"CHK-COPY-RTL-01","verdict":"pass","observed":"Login namespace Hebrew copy; no raw keys.","evidence":["screenshots/step-01-login.png"]}],"findings":[],"known_issues_observed":[],"not_tested":["Resend throttle","429 rate limit","Cookie-less redirect","Exploration budget"],"limitations":["Shared browser context prevented unauthed redirect test"],"coverage_summary":{"total":11,"pass":8,"fail":0,"blocked":1,"not_checked":2}}
