{"run_id":"2026-07-15T17-48_012-desktop-viewport","charter_id":"012-desktop-viewport","charter_path":"qa/charters/012-desktop-viewport.md","started_at":"2026-07-15T15:35:00Z","finished_at":"2026-07-15T15:42:00Z","environment":{"base_url":"http://localhost:3100","git_sha":"172d979df3635ffe402dc96c524ee32122e05c2f","app_version":"0.3.141","supabase_host":"nvgqczaesfeotijjcbed.supabase.co","viewport":"1440x900","locale":"he"},"checks":[{"id":"CHK-DESK-01","verdict":"pass","observed":"scrollWidth 1425 <= innerWidth 1440 on home at desktop viewport.","evidence":["screenshots/step-desktop-home.png"]},{"id":"CHK-DESK-02","verdict":"pass","observed":"Content renders in centered column not full 1440px width.","evidence":["screenshots/step-desktop-home.png"]},{"id":"CHK-DESK-03","verdict":"pass","observed":"Tab bar visible on desktop home screenshot.","evidence":["screenshots/step-desktop-home.png"]},{"id":"CHK-DESK-04","verdict":"not-checked","observed":"","evidence":[],"reason":"timebox — mouse quiz interaction not exercised at desktop"},{"id":"CHK-DESK-05","verdict":"pass","observed":"No overlapping controls visible on swept desktop screenshots.","evidence":["screenshots/step-desktop-quiz.png"]},{"id":"CHK-DESK-06","verdict":"pass","observed":"Images within cards at natural proportions on quiz/flashcards desktop views.","evidence":["screenshots/step-desktop-flashcards.png"]},{"id":"CHK-DESK-07","verdict":"not-checked","observed":"","evidence":[],"reason":"timebox — keyboard quiz loop not exercised"},{"id":"CHK-CONSOLE-01","verdict":"pass","observed":"No error-level console entries on desktop sweep.","evidence":["console.log"]},{"id":"CHK-A11Y-01","verdict":"pass","observed":"Headings and landmarks present at desktop width.","evidence":["screenshots/step-desktop-home.png"]},{"id":"CHK-COPY-RTL-01","verdict":"pass","observed":"RTL layout correct at 1440px on sampled pages.","evidence":["screenshots/step-desktop-home.png"]}],"findings":[],"known_issues_observed":[],"not_tested":["Full desktop sweep all pages","Keyboard quiz loop","Exploration budget"],"limitations":[],"coverage_summary":{"total":10,"pass":8,"fail":0,"blocked":0,"not_checked":2}}
