{
  "run_id": "2026-07-14T21-13_006-more-settings-and-logout",
  "charter_id": "006-more-settings-and-logout",
  "charter_path": "qa/charters/006-more-settings-and-logout.md",
  "started_at": "2026-07-14T21:13:00Z",
  "finished_at": "2026-07-14T21:20:00Z",
  "environment": {"base_url": "http://localhost:3100", "git_sha": "cd095d1a60cee1421a6faac16f49b51a18218cff", "app_version": "0.3.130", "supabase_host": "nvgqczaesfeotijjcbed.supabase.co", "viewport": "390x844", "locale": "he"},
  "checks": [
    {"id": "CHK-MORE-01", "verdict": "pass", "observed": "More page streak 3 and 3010 points matched home dashboard in the same run.", "evidence": ["screenshots/step-01-home-stats.png", "screenshots/step-02-more-page.png"]},
    {"id": "CHK-MORE-02", "verdict": "pass", "observed": "Medals grid showed 3-day earned with date and unearned medals marked with dash.", "evidence": ["screenshots/step-02-more-page.png"]},
    {"id": "CHK-MORE-03", "verdict": "pass", "observed": "Rows linked to /exam, /schedule, and /credits.", "evidence": ["screenshots/step-02-more-page.png"]},
    {"id": "CHK-MORE-04", "verdict": "pass", "observed": "Dark-mode toggle flipped html[data-theme] to light and persisted after reload via theme cookie.", "evidence": ["screenshots/step-03-light-theme.png"]},
    {"id": "CHK-MORE-05", "verdict": "pass", "observed": "Language toggle navigated /he/more to /ar/more and back to /he/more with lang/dir updated.", "evidence": ["screenshots/step-04-ar-more.png"]},
    {"id": "CHK-MORE-06", "verdict": "pass", "observed": "POST /api/auth/logout returned 200; /he then redirected to /he/auth/login.", "evidence": ["screenshots/step-05-login-after-logout.png", "network.log"]},
    {"id": "CHK-CONSOLE-01", "verdict": "pass", "observed": "No console errors during More flow.", "evidence": ["console.log"]},
    {"id": "CHK-A11Y-01", "verdict": "pass", "observed": "Dark-mode switch, language button aria-label, logout button, and h1 present; medals use text not color-only.", "evidence": ["screenshots/step-02-more-page.png"]},
    {"id": "CHK-COPY-RTL-01", "verdict": "pass", "observed": "Hebrew More copy rendered RTL without raw keys.", "evidence": ["screenshots/step-02-more-page.png"]}
  ],
  "findings": [],
  "known_issues_observed": [],
  "not_tested": ["Full Arabic content sweep (007)", "Earning new medals", "Desktop viewport"],
  "limitations": ["Logout triggered via fetch after UI click did not navigate in automated session"],
  "coverage_summary": {"total": 9, "pass": 9, "fail": 0, "blocked": 0, "not_checked": 0}
}
