{"run_id":"2026-07-15T17-48_009-new-user-empty-states","charter_id":"009-new-user-empty-states","charter_path":"qa/charters/009-new-user-empty-states.md","started_at":"2026-07-15T15:12:00Z","finished_at":"2026-07-15T15:20:00Z","environment":{"base_url":"http://localhost:3100","git_sha":"172d979df3635ffe402dc96c524ee32122e05c2f","app_version":"0.3.141","supabase_host":"nvgqczaesfeotijjcbed.supabase.co","viewport":"390x844","locale":"he"},"checks":[{"id":"CHK-EMPTY-01","verdict":"pass","observed":"Fresh user home shows streak 0 and points 0 pills.","evidence":["screenshots/step-01-fresh-home.png"]},{"id":"CHK-EMPTY-02","verdict":"pass","observed":"All topics not-started; completed counter 0 / 4.","evidence":["screenshots/step-01-fresh-home.png"]},{"id":"CHK-EMPTY-03","verdict":"pass","observed":"Readiness card shows empty-state invitation; no weak-topics section.","evidence":["screenshots/step-01-fresh-home.png"]},{"id":"CHK-EMPTY-04","verdict":"pass","observed":"Exam landing shows empty history treatment for fresh user.","evidence":["screenshots/step-02-fresh-exam.png"]},{"id":"CHK-EMPTY-05","verdict":"pass","observed":"Signs review shows localized empty state for fresh user.","evidence":["screenshots/step-03-fresh-review-empty.png"]},{"id":"CHK-EMPTY-06","verdict":"pass","observed":"More page stats zeros; medals unearned.","evidence":["screenshots/step-01-fresh-home.png"]},{"id":"CHK-INIT-01","verdict":"fail","observed":"After one confirmed correct answer, dashboard pills remained streak 0 and points 0 (expected 1 and 10).","evidence":["screenshots/step-04-after-init.png"]},{"id":"CHK-INIT-02","verdict":"pass","observed":"Vehicle topic shows 1/106 progress after first answer, no longer pristine not-started.","evidence":["screenshots/step-04-after-init.png"]},{"id":"CHK-CONSOLE-01","verdict":"pass","observed":"No error-level console entries on empty states.","evidence":["console.log"]},{"id":"CHK-A11Y-01","verdict":"pass","observed":"Empty states use real text headings and buttons.","evidence":["screenshots/step-03-fresh-review-empty.png"]},{"id":"CHK-COPY-RTL-01","verdict":"pass","observed":"Empty-state Hebrew copy without raw keys.","evidence":["screenshots/step-01-fresh-home.png"]}],"findings":[{"id":"F-001","title":"First correct answer does not initialize streak and star points pills","severity":"major","confidence":"medium","category":"data","related_checks":["CHK-INIT-01"],"repro_steps":["Mint fresh user qa-fresh-*@clearroad.test","Open /he/topics/vehicle","Answer one question correctly","Return to /he dashboard"],"expected":"Streak pill 1 and points pill 10 after first correct answer","actual":"Pills remained 0/0 though topic progress updated to 1/106","evidence":["screenshots/step-04-after-init.png"]}],"known_issues_observed":[],"not_tested":["Flashcards/schedule fresh defaults","Exploration budget"],"limitations":[],"coverage_summary":{"total":11,"pass":9,"fail":1,"blocked":0,"not_checked":0}}
