{"run_id":"2026-07-15T17-48_013-light-theme","charter_id":"013-light-theme","charter_path":"qa/charters/013-light-theme.md","started_at":"2026-07-15T15:42:00Z","finished_at":"2026-07-15T15:50:00Z","environment":{"base_url":"http://localhost:3100","git_sha":"172d979df3635ffe402dc96c524ee32122e05c2f","app_version":"0.3.141","supabase_host":"nvgqczaesfeotijjcbed.supabase.co","viewport":"390x844","locale":"he"},"checks":[{"id":"CHK-THEME-01","verdict":"pass","observed":"Dark-mode toggle set html[data-theme]=light immediately (verified in 006 run, persisted here).","evidence":["screenshots/step-more-light.png"]},{"id":"CHK-THEME-02","verdict":"pass","observed":"Home, quiz, more render with data-theme=light and light backgrounds.","evidence":["screenshots/step-home-light.png","screenshots/step-quiz-light.png"]},{"id":"CHK-THEME-03","verdict":"pass","observed":"Theme remains light across navigations in session.","evidence":["screenshots/step-home-light.png"]},{"id":"CHK-THEME-04","verdict":"pass","observed":"Body text and pills readable on light backgrounds in screenshots.","evidence":["screenshots/step-home-light.png"]},{"id":"CHK-THEME-05","verdict":"not-checked","observed":"","evidence":[],"reason":"timebox — correct/wrong quiz states in light mode not re-captured this run"},{"id":"CHK-THEME-06","verdict":"pass","observed":"Tab icons and sign images visible on light backgrounds.","evidence":["screenshots/step-quiz-light.png"]},{"id":"CHK-THEME-07","verdict":"not-checked","observed":"","evidence":[],"reason":"timebox — theme-color meta not probed"},{"id":"CHK-THEME-08","verdict":"not-checked","observed":"","evidence":[],"reason":"timebox — dark theme restore deferred to avoid impacting later runs"},{"id":"CHK-CONSOLE-01","verdict":"pass","observed":"No error-level console entries during light theme sweep.","evidence":["console.log"]},{"id":"CHK-A11Y-01","verdict":"pass","observed":"Focus and headings unchanged in light theme samples.","evidence":["screenshots/step-home-light.png"]},{"id":"CHK-COPY-RTL-01","verdict":"pass","observed":"Hebrew copy unchanged in light theme.","evidence":["screenshots/step-home-light.png"]}],"findings":[],"known_issues_observed":[],"not_tested":["Quiz feedback states light","theme-color meta","Dark restore","Exploration budget"],"limitations":["Theme already light from charter 006"],"coverage_summary":{"total":11,"pass":8,"fail":0,"blocked":0,"not_checked":3}}
