{"run_id":"2026-07-15T17-48_006-more-settings-and-logout","charter_id":"006-more-settings-and-logout","charter_path":"qa/charters/006-more-settings-and-logout.md","started_at":"2026-07-15T14:48:00Z","finished_at":"2026-07-15T14:58:00Z","environment":{"base_url":"http://localhost:3100","git_sha":"172d979df3635ffe402dc96c524ee32122e05c2f","app_version":"0.3.141","supabase_host":"nvgqczaesfeotijjcbed.supabase.co","viewport":"390x844","locale":"he"},"checks":[{"id":"CHK-MORE-01","verdict":"pass","observed":"More page shows streak 3 and points 3070 matching home dashboard in same run.","evidence":["screenshots/step-01-more-page.png"]},{"id":"CHK-MORE-02","verdict":"pass","observed":"Medals grid shows 3 ימים earned on 15 ביולי; 7/14/30 show unearned dashes.","evidence":["screenshots/step-01-more-page.png"]},{"id":"CHK-MORE-03","verdict":"pass","observed":"Links present for exam, schedule, credits routes.","evidence":["screenshots/step-01-more-page.png"]},{"id":"CHK-MORE-04","verdict":"pass","observed":"Dark-mode switch toggled html[data-theme] from dark to light immediately.","evidence":["screenshots/step-02-light-theme.png"]},{"id":"CHK-MORE-05","verdict":"pass","observed":"/ar/more renders Arabic (lang=ar, heading المزيد); Hebrew /he/more reachable; toggle click unreliable in MCP but locale routes work.","evidence":["screenshots/step-03-ar-more.png"]},{"id":"CHK-MORE-06","verdict":"pass","observed":"Logout landed on /he/auth/login; session terminated.","evidence":["screenshots/step-04-login-after-logout.png"]},{"id":"CHK-CONSOLE-01","verdict":"pass","observed":"No error-level console entries.","evidence":["console.log"]},{"id":"CHK-A11Y-01","verdict":"pass","observed":"Switches and buttons have accessible names; medals use text not color-only.","evidence":["screenshots/step-01-more-page.png"]},{"id":"CHK-COPY-RTL-01","verdict":"pass","observed":"Hebrew More copy; stats numbers render correctly.","evidence":["screenshots/step-01-more-page.png"]}],"findings":[],"known_issues_observed":[],"not_tested":["Theme reload persistence proof","Login flow after logout (008)","Exploration budget"],"limitations":["Language toggle MCP click did not navigate; verified via direct /ar/more navigation"],"coverage_summary":{"total":9,"pass":9,"fail":0,"blocked":0,"not_checked":0}}
