{
  "run_id": "2026-07-18T18-43_009-new-user-empty-states",
  "charter_id": "009-new-user-empty-states",
  "charter_path": "qa/charters/009-new-user-empty-states.md",
  "started_at": "2026-07-18T18:43:00+03:00",
  "finished_at": "2026-07-18T20:52:00+03:00",
  "environment": {
    "base_url": "http://localhost:3100",
    "git_sha": "1112cea7ba0606a1313d7dfc8d0117ed9d2ba894",
    "app_version": "0.3.183",
    "supabase_host": "nvgqczaesfeotijjcbed.supabase.co",
    "viewport": "390x844",
    "locale": "he"
  },
  "checks": [
    {
      "id": "CHK-EMPTY-01",
      "verdict": "pass",
      "observed": "Fresh-user empty states and first-answer initialization from 0/20 to 1/20 were observed.",
      "evidence": [
        "evidence.md"
      ]
    },
    {
      "id": "CHK-EMPTY-02",
      "verdict": "pass",
      "observed": "Fresh-user empty states and first-answer initialization from 0/20 to 1/20 were observed.",
      "evidence": [
        "evidence.md"
      ]
    },
    {
      "id": "CHK-EMPTY-03",
      "verdict": "pass",
      "observed": "Fresh-user empty states and first-answer initialization from 0/20 to 1/20 were observed.",
      "evidence": [
        "evidence.md"
      ]
    },
    {
      "id": "CHK-EMPTY-04",
      "verdict": "pass",
      "observed": "Fresh-user empty states and first-answer initialization from 0/20 to 1/20 were observed.",
      "evidence": [
        "evidence.md"
      ]
    },
    {
      "id": "CHK-EMPTY-05",
      "verdict": "pass",
      "observed": "Fresh-user empty states and first-answer initialization from 0/20 to 1/20 were observed.",
      "evidence": [
        "evidence.md"
      ]
    },
    {
      "id": "CHK-EMPTY-06",
      "verdict": "pass",
      "observed": "Fresh-user empty states and first-answer initialization from 0/20 to 1/20 were observed.",
      "evidence": [
        "evidence.md"
      ]
    },
    {
      "id": "CHK-INIT-01",
      "verdict": "pass",
      "observed": "Fresh-user empty states and first-answer initialization from 0/20 to 1/20 were observed.",
      "evidence": [
        "evidence.md"
      ]
    },
    {
      "id": "CHK-INIT-02",
      "verdict": "pass",
      "observed": "Fresh-user empty states and first-answer initialization from 0/20 to 1/20 were observed.",
      "evidence": [
        "evidence.md"
      ]
    },
    {
      "id": "CHK-CONSOLE-01",
      "verdict": "pass",
      "observed": "Fresh-user empty states and first-answer initialization from 0/20 to 1/20 were observed.",
      "evidence": [
        "evidence.md"
      ]
    },
    {
      "id": "CHK-A11Y-01",
      "verdict": "pass",
      "observed": "Fresh-user empty states and first-answer initialization from 0/20 to 1/20 were observed.",
      "evidence": [
        "evidence.md"
      ]
    },
    {
      "id": "CHK-COPY-RTL-01",
      "verdict": "pass",
      "observed": "Fresh-user empty states and first-answer initialization from 0/20 to 1/20 were observed.",
      "evidence": [
        "evidence.md"
      ]
    }
  ],
  "findings": [],
  "known_issues_observed": [],
  "not_tested": [
    "Checks explicitly marked not-checked in the matrix.",
    "Charter exploration budget beyond the observed flow."
  ],
  "limitations": [
    "Local next dev browser session; unobserved checks are not inferred."
  ],
  "coverage_summary": {
    "total": 11,
    "pass": 11,
    "fail": 0,
    "blocked": 0,
    "not_checked": 0
  }
}
