{"run_id":"2026-07-14T21-20_010-static-pages-and-not-found","charter_id":"010-static-pages-and-not-found","charter_path":"qa/charters/010-static-pages-and-not-found.md","started_at":"2026-07-14T21:20:00Z","finished_at":"2026-07-14T21:26:00Z","environment":{"base_url":"http://localhost:3100","git_sha":"cd095d1a60cee1421a6faac16f49b51a18218cff","app_version":"0.3.130","supabase_host":"nvgqczaesfeotijjcbed.supabase.co","viewport":"390x844","locale":"he"},"checks":[{"id":"CHK-STATIC-01","verdict":"pass","observed":"Videos page listed 6 YouTube lessons with https hrefs opening in new tab.","evidence":["screenshots/step-01-videos.png"]},{"id":"CHK-STATIC-02","verdict":"pass","observed":"Resources page listed 4 external https links with target _blank.","evidence":["screenshots/step-01-videos.png"]},{"id":"CHK-STATIC-03","verdict":"pass","observed":"Credits page rendered attributions with external https links.","evidence":["screenshots/step-01-videos.png"]},{"id":"CHK-STATIC-04","verdict":"pass","observed":"Sample probes: YouTube 200, gov.il 403 (question), noeg 200.","evidence":["network.log"]},{"id":"CHK-404-01","verdict":"pass","observed":"Bad topic slug showed Hebrew NotFound page with home link to /he.","evidence":["screenshots/step-02-404-topic.png"]},{"id":"CHK-404-02","verdict":"pass","observed":"/he/no-such-page showed same localized 404 with home link.","evidence":["screenshots/step-02-404-topic.png"]},{"id":"CHK-404-03","verdict":"fail","observed":"404 pages lacked tab bar navigation; only inline home link provided.","evidence":["screenshots/step-02-404-topic.png"]},{"id":"CHK-CONSOLE-01","verdict":"pass","observed":"No console errors on static/404 pages.","evidence":["console.log"]},{"id":"CHK-A11Y-01","verdict":"pass","observed":"Headings and link names present; external links named.","evidence":["screenshots/step-01-videos.png"]},{"id":"CHK-COPY-RTL-01","verdict":"pass","observed":"Hebrew copy RTL without raw keys on swept pages.","evidence":["screenshots/step-02-404-topic.png"]}],"findings":[{"id":"F-001","title":"404 pages omit tab bar recovery navigation","severity":"minor","confidence":"high","category":"functional","related_checks":["CHK-404-03"],"repro_steps":["Visit /he/topics/not-a-real-slug or /he/no-such-page"],"expected":"Tab bar remains usable for recovery.","actual":"404 layout shows only a home link; no navigation landmark/tab bar.","evidence":["screenshots/step-02-404-topic.png"],"known_issue_match":null}],"known_issues_observed":[],"not_tested":["Error boundary","Arabic locale","Desktop","Off-origin content correctness"],"limitations":["gov.il returned 403 to curl probe only"],"coverage_summary":{"total":10,"pass":9,"fail":1,"blocked":0,"not_checked":0}}
