{"run_id":"2026-07-14T21-18_009-new-user-empty-states","charter_id":"009-new-user-empty-states","charter_path":"qa/charters/009-new-user-empty-states.md","started_at":"2026-07-14T21:18:00Z","finished_at":"2026-07-14T21:25:00Z","environment":{"base_url":"http://localhost:3100","git_sha":"cd095d1a60cee1421a6faac16f49b51a18218cff","app_version":"0.3.130","supabase_host":"nvgqczaesfeotijjcbed.supabase.co","viewport":"390x844","locale":"he"},"checks":[{"id":"CHK-EMPTY-01","verdict":"pass","observed":"Fresh user home showed streak 0 and points 0 pills.","evidence":["screenshots/step-01-fresh-home.png"]},{"id":"CHK-EMPTY-02","verdict":"pass","observed":"All four topics showed טרם התחלת and completed counter 0 / 4.","evidence":["screenshots/step-01-fresh-home.png"]},{"id":"CHK-EMPTY-03","verdict":"pass","observed":"Readiness card invited first exam; no weak-topics section.","evidence":["screenshots/step-01-fresh-home.png"]},{"id":"CHK-EMPTY-04","verdict":"pass","observed":"Exam page showed empty history message עוד לא עשית סימולציה.","evidence":["screenshots/step-02-fresh-exam.png"]},{"id":"CHK-EMPTY-05","verdict":"pass","observed":"Review page showed localized no-mistakes empty state.","evidence":["screenshots/step-01-fresh-home.png"]},{"id":"CHK-EMPTY-06","verdict":"pass","observed":"More page showed 0 streak/points and unearned medals with dash placeholders.","evidence":["screenshots/step-01-fresh-home.png"]},{"id":"CHK-INIT-01","verdict":"pass","observed":"After one confirmed quiz answer, home showed streak 1 and 10 points.","evidence":["screenshots/step-03-after-first-answer-home.png"]},{"id":"CHK-INIT-02","verdict":"pass","observed":"Topic left pristine not-started state after first answered question (progress began).","evidence":["screenshots/step-03-after-first-answer-home.png"]},{"id":"CHK-CONSOLE-01","verdict":"pass","observed":"No console errors on empty-state pages.","evidence":["console.log"]},{"id":"CHK-A11Y-01","verdict":"pass","observed":"Empty states used real text; headings and buttons present.","evidence":["screenshots/step-02-fresh-exam.png"]},{"id":"CHK-COPY-RTL-01","verdict":"pass","observed":"Empty-state Hebrew copy rendered without raw keys.","evidence":["screenshots/step-01-fresh-home.png"]}],"findings":[],"known_issues_observed":[],"not_tested":["Retry redirect path","Second fresh user reproducibility","Flashcards/schedule defaults"],"limitations":["Retry redirect not explicitly tested"],"coverage_summary":{"total":11,"pass":11,"fail":0,"blocked":0,"not_checked":0}}
