{"run_id":"2026-07-15T17-48_011-pwa-and-offline","charter_id":"011-pwa-and-offline","charter_path":"qa/charters/011-pwa-and-offline.md","started_at":"2026-07-15T15:28:00Z","finished_at":"2026-07-15T15:35:00Z","environment":{"base_url":"http://localhost:3100","git_sha":"172d979df3635ffe402dc96c524ee32122e05c2f","app_version":"0.3.141","supabase_host":"nvgqczaesfeotijjcbed.supabase.co","viewport":"390x844","locale":"he"},"checks":[{"id":"CHK-PWA-01","verdict":"pass","observed":"manifest.webmanifest returns dir=rtl display=standalone with icons.","evidence":["console.log"]},{"id":"CHK-PWA-02","verdict":"pass","observed":"/sw.js 200; navigator.serviceWorker.controller non-null.","evidence":["console.log"]},{"id":"CHK-PWA-03","verdict":"pass","observed":"CacheStorage has clearroad-static-v1, clearroad-pages-v1, clearroad-images-v1.","evidence":["console.log"]},{"id":"CHK-PWA-04","verdict":"pass","observed":"Offline reload of visited /he rendered cached page (not browser offline error).","evidence":["screenshots/step-offline-home.png"]},{"id":"CHK-PWA-05","verdict":"not-checked","observed":"","evidence":[],"reason":"timebox — offline API action failure handling not exercised"},{"id":"CHK-PWA-06","verdict":"pass","observed":"Back online assets load without cache console errors in sampled flow.","evidence":["console.log"]},{"id":"CHK-CONSOLE-01","verdict":"pass","observed":"No unhandled exceptions from SW in online phases.","evidence":["console.log"]},{"id":"CHK-A11Y-01","verdict":"pass","observed":"Offline cached page retains lang/dir and headings.","evidence":["screenshots/step-offline-home.png"]},{"id":"CHK-COPY-RTL-01","verdict":"pass","observed":"Cached Hebrew UI without raw keys.","evidence":["screenshots/step-offline-home.png"]}],"findings":[],"known_issues_observed":[],"not_tested":["Push events","Offline API failure UX","Exploration budget"],"limitations":["Dev-mode service worker behavior may differ from production"],"coverage_summary":{"total":9,"pass":8,"fail":0,"blocked":0,"not_checked":1}}
