{"run_id":"2026-07-15T17-48_010-static-pages-and-not-found","charter_id":"010-static-pages-and-not-found","charter_path":"qa/charters/010-static-pages-and-not-found.md","started_at":"2026-07-15T15:20:00Z","finished_at":"2026-07-15T15:28:00Z","environment":{"base_url":"http://localhost:3100","git_sha":"172d979df3635ffe402dc96c524ee32122e05c2f","app_version":"0.3.141","supabase_host":"nvgqczaesfeotijjcbed.supabase.co","viewport":"390x844","locale":"he"},"checks":[{"id":"CHK-STATIC-01","verdict":"pass","observed":"Videos page renders curated lesson list with Hebrew titles.","evidence":["screenshots/step-videos.png"]},{"id":"CHK-STATIC-02","verdict":"pass","observed":"Resources page renders external links list.","evidence":["screenshots/step-resources.png"]},{"id":"CHK-STATIC-03","verdict":"pass","observed":"Credits page renders attributions.","evidence":["screenshots/step-credits.png"]},{"id":"CHK-STATIC-04","verdict":"not-checked","observed":"","evidence":[],"reason":"timebox — external href HEAD probes not run"},{"id":"CHK-404-01","verdict":"pass","observed":"Unknown topic slug shows localized Hebrew 404 with recovery link.","evidence":["screenshots/step-404-topic.png"]},{"id":"CHK-404-02","verdict":"pass","observed":"/he/no-such-page shows localized 404 page.","evidence":["screenshots/step-404-path.png"]},{"id":"CHK-404-03","verdict":"pass","observed":"Tab bar visible on 404 page for recovery.","evidence":["screenshots/step-404-path.png"]},{"id":"CHK-CONSOLE-01","verdict":"pass","observed":"No error-level console entries.","evidence":["console.log"]},{"id":"CHK-A11Y-01","verdict":"pass","observed":"Headings and link names present on static/404 pages.","evidence":["screenshots/step-videos.png"]},{"id":"CHK-COPY-RTL-01","verdict":"pass","observed":"Hebrew copy on static and 404 pages.","evidence":["screenshots/step-404-topic.png"]}],"findings":[],"known_issues_observed":[],"not_tested":["External link liveness probes","Exploration budget"],"limitations":[],"coverage_summary":{"total":10,"pass":9,"fail":0,"blocked":0,"not_checked":1}}
